{
  "matrix_schema_version": "1.0.0",
  "matrix_id": "PROJECT7-P2-05-PRIOR-PROJECT-TRACEABILITY",
  "decision_baseline": "Projects 1, 2, 4, and 6 contribute runtime assets or methods. Projects 3 and 5 contribute bounded design and evaluation evidence, while their trained models are excluded from Project 7 runtime.",
  "entries": [
    {
      "trace_id": "TR-P1-01",
      "prior_project": 1,
      "source_repository": "https://github.com/icmsol/ai-programming-foundations-project",
      "source_artifact": "data_workflow.ipynb — reusable column and text standardization functions",
      "source_url": "https://github.com/icmsol/ai-programming-foundations-project/blob/main/data_workflow.ipynb",
      "original_role": "Standardized Cal eProcure HTML-table exports into a reproducible tabular structure.",
      "reuse_classification": "adapted_runtime_reuse",
      "project7_target": "src/intake/normalization.py (planned)",
      "project7_role": "Provide the initial reusable normalization patterns behind a source-adapter interface.",
      "runtime_status": "planned_for_implementation",
      "transformation": "Extract functions from notebook cells, add type checks, source adapters, schema validation, and structured errors.",
      "limitations": "The original implementation is Cal eProcure-specific and was not designed as a multi-source production library.",
      "required_safeguards": [
        "SG-003",
        "SG-004",
        "SG-005"
      ],
      "validation_evidence": "Project 1 reusable-asset review plus Project 7 opportunity schema and component contract.",
      "decision": "adapt",
      "decision_rationale": "The normalization logic remains useful, but Project 7 requires a common contract across portals and preserved provenance."
    },
    {
      "trace_id": "TR-P1-02",
      "prior_project": 1,
      "source_repository": "https://github.com/icmsol/ai-programming-foundations-project",
      "source_artifact": "data_workflow.ipynb — deadline parsing and original-value retention",
      "source_url": "https://github.com/icmsol/ai-programming-foundations-project/blob/main/data_workflow.ipynb",
      "original_role": "Parsed source deadlines while retaining the original deadline representation for auditability.",
      "reuse_classification": "adapted_runtime_reuse",
      "project7_target": "src/intake/normalization.py and opportunity_record.schema.json",
      "project7_role": "Preserve source values while creating normalized date-time fields and explicit parse limitations.",
      "runtime_status": "planned_for_implementation",
      "transformation": "Generalize parsing by source portal and jurisdiction; preserve failed parses in missing_fields and limitations.",
      "limitations": "Portal-specific date formats and time zones may differ, and missing deadlines cannot be inferred.",
      "required_safeguards": [
        "SG-004",
        "SG-005",
        "SG-009"
      ],
      "validation_evidence": "Project 7 opportunity schema requires original_values, missing_fields, provenance, and normalized timestamps.",
      "decision": "adapt",
      "decision_rationale": "This is a strong reproducibility pattern that supports the new shared data contract."
    },
    {
      "trace_id": "TR-P1-03",
      "prior_project": 1,
      "source_repository": "https://github.com/icmsol/ai-programming-foundations-project",
      "source_artifact": "data_workflow.ipynb — composite record-key approach",
      "source_url": "https://github.com/icmsol/ai-programming-foundations-project/blob/main/data_workflow.ipynb",
      "original_role": "Avoided treating Event ID as globally unique and constructed a composite record identifier.",
      "reuse_classification": "adapted_runtime_reuse",
      "project7_target": "src/intake/identity.py (planned)",
      "project7_role": "Generate deterministic record keys from source identity and stable normalized fields.",
      "runtime_status": "planned_for_implementation",
      "transformation": "Replace notebook-specific composition with a versioned SHA-256-derived key contract.",
      "limitations": "Source identifiers may change, duplicate, or be absent across portals.",
      "required_safeguards": [
        "SG-004",
        "SG-005"
      ],
      "validation_evidence": "Project 7 opportunity_record.schema.json requires a deterministic 20-character record_key.",
      "decision": "adapt",
      "decision_rationale": "The original lesson is retained while the key algorithm is made versioned and cross-source."
    },
    {
      "trace_id": "TR-P1-04",
      "prior_project": 1,
      "source_repository": "https://github.com/icmsol/ai-programming-foundations-project",
      "source_artifact": "data/processed/caleprocure_bids_combined.csv",
      "source_url": "https://github.com/icmsol/ai-programming-foundations-project/blob/main/data/processed/caleprocure_bids_combined.csv",
      "original_role": "Combined one year of completed solicitations with a frozen current-open snapshot.",
      "reuse_classification": "design_evidence",
      "project7_target": "docs/Project_1_2_Reusable_Asset_Review.md",
      "project7_role": "Demonstrate the evolution from a single-source opportunity workflow to the Project 2 multi-source foundation.",
      "runtime_status": "reference_only",
      "transformation": "Use only as lineage and early-workflow evidence; do not load into the Project 7 historical context.",
      "limitations": "The period is short, the source is Cal eProcure-only, and Project 2 supersedes it with five years and multiple portals.",
      "required_safeguards": [
        "SG-005",
        "SG-010"
      ],
      "validation_evidence": "Project 1 repository README and Project 7 reusable-asset review.",
      "decision": "reference",
      "decision_rationale": "The artifact supports portfolio continuity but is not the strongest runtime dataset."
    },
    {
      "trace_id": "TR-P1-05",
      "prior_project": 1,
      "source_repository": "https://github.com/icmsol/ai-programming-foundations-project",
      "source_artifact": "Hard-coded ICM opportunity-screening rules in data_workflow.ipynb",
      "source_url": "https://github.com/icmsol/ai-programming-foundations-project/blob/main/data_workflow.ipynb",
      "original_role": "Produced a conservative manual-review list using ICM-specific keyword rules.",
      "reuse_classification": "superseded",
      "project7_target": "config/profiles/* plus service_alignment_engine.contract.json",
      "project7_role": "Replace hard-coded screening with organization-configurable services, exclusions, reason codes, and safeguards.",
      "runtime_status": "not_used",
      "transformation": "Retain concepts only; move all business criteria into validated CSV and JSON profile artifacts.",
      "limitations": "Hard-coded ICM logic prevents portability and mixes business configuration with executable code.",
      "required_safeguards": [
        "SG-002",
        "SG-003",
        "SG-009"
      ],
      "validation_evidence": "P1/P2 reusable-asset review and the Project 7 configuration portability smoke test.",
      "decision": "replace",
      "decision_rationale": "The concept remains useful, but the implementation conflicts with the approved configuration-first design."
    },
    {
      "trace_id": "TR-P2-01",
      "prior_project": 2,
      "source_repository": "https://github.com/icmsol/Capstone-project-2-statistical-analysis",
      "source_artifact": "analysis.ipynb — multi-source field standardization",
      "source_url": "https://github.com/icmsol/Capstone-project-2-statistical-analysis/blob/main/analysis.ipynb",
      "original_role": "Standardized California, El Dorado County, and Sacramento procurement exports.",
      "reuse_classification": "adapted_runtime_reuse",
      "project7_target": "src/intake/source_adapters/ and src/intake/normalization.py (planned)",
      "project7_role": "Provide the primary structured-data ingestion foundation for multiple public procurement sources.",
      "runtime_status": "planned_for_implementation",
      "transformation": "Extract deterministic source adapters and validate every output against opportunity_record.schema.json.",
      "limitations": "The three portals differ in retention, status terms, schema, and coverage.",
      "required_safeguards": [
        "SG-003",
        "SG-004",
        "SG-005",
        "SG-009"
      ],
      "validation_evidence": "Project 1/2 reusable-asset review; Project 2 repository structure and documented analytical workflow.",
      "decision": "adapt",
      "decision_rationale": "Project 2 is the strongest prior structured-data foundation and supersedes Project 1 for runtime ingestion."
    },
    {
      "trace_id": "TR-P2-02",
      "prior_project": 2,
      "source_repository": "https://github.com/icmsol/Capstone-project-2-statistical-analysis",
      "source_artifact": "data/processed/analysis_summary.json",
      "source_url": "https://github.com/icmsol/Capstone-project-2-statistical-analysis/blob/main/data/processed/analysis_summary.json",
      "original_role": "Stored reproducible summary statistics for the five-year historical analysis.",
      "reuse_classification": "executable_reuse",
      "project7_target": "data/reference/project2/analysis_summary.json (planned frozen copy)",
      "project7_role": "Supply checksum-verified descriptive historical context and provenance.",
      "runtime_status": "committed_not_yet_integrated",
      "transformation": "Copy the frozen artifact with source URL, checksum, and approved prior-project registry entry.",
      "limitations": "The statistics are historical, descriptive, and do not predict current award probability or capacity.",
      "required_safeguards": [
        "SG-005",
        "SG-010",
        "SG-018"
      ],
      "validation_evidence": "P1-05 smoke test downloaded and validated the asset and recorded its checksum.",
      "decision": "retain",